{
  "projectName": "De stille generatie in verbinding",
  "creators": [
    "Demi Houtepen"
  ],
  "description": "De stille generatie in verbinding van Demi Houtepen onderzoekt hoe storytelling kan bijdragen aan meer begrip en verbondenheid tussen eenzame ouderen en jongere generaties. Vanuit het groeiende maatschappelijke probleem van eenzaamheid bij ouderen ontwikkelde Demi een documentaire die niet alleen inzicht geeft in hun leefwereld, maar ook jongeren uitnodigt tot reflectie en actie. De titel verwijst zowel naar het zwijgen rond eenzaamheid als naar een generatie die in de moderne samenleving minder gehoord wordt. Door middel van persoonlijke verhalen, emotionele beelden en herkenbare situaties wordt het taboe rond eenzaamheid doorbroken. De documentaire en bijbehorende korte “snipit”-video zijn ontworpen om via digitale media jongeren te raken en betrekken, en zo de intergenerationele kloof te verkleinen. De stille generatie in verbinding is daarmee zowel een ontwerpend onderzoek als een sociaal statement over empathie en menselijke verbinding.\n\nhttps://avanscmd.nl/work/graduation-2025/de-stille-generatie-in-verbinding",
  "tags": [
    "Storytelling",
    "Documentaire"
  ],
  "category": [
    "Media",
    "Social"
  ],
  "year": "2025",
  "imageFile": "thumbnail.png"
}